{
  "version": "1.2",
  "date": "2026-10-23",
  "baseline": "stage1-loop-ready; stage2-4 roadmap",
  "supersedes": "1.1",
  "schema": "schemas/registry.schema.json",
  "stages": [
    {
      "stage": 1,
      "name": "Existing tools + blog upgrade",
      "features": [
        "RETAIN/VERIFY: Daily Protein Target calculator (no engine rewrite; audit source, safety and email)",
        "RETAIN/VERIFY: Diabetes Risk Screening tool (actual deployed engine must be identified; approved safety pathways)",
        "ADD: Tools-first homepage, navigation and two-tool hub/landing pages",
        "ADD: Contextual article-to-tool and tool-to-article links; reviewed methodology/limitation pages",
        "ADD: Privacy-safe aggregate referral/click analytics; clinical, security and regression controls",
        "DO NOT ADD: new calculators, member accounts, persistent personal tracking, subscriptions or mobile app."
      ]
    },
    {
      "stage": 2,
      "name": "Website membership & improvement MVP",
      "features": [
        "ADD: Secure member registration, recovery, consent/preferences and adult eligibility",
        "ADD: Health Goal Selector (up to three goals) and editable preferences",
        "ADD: Explainable personalised article/tool suggestions from reviewed WordPress categories",
        "ADD: Four-week Healthy Habits programme, actions, enrolment and progress check-ins",
        "ADD: Basic member dashboard, account data export/deletion and notifications settings",
        "ADD: Optional premium membership/payment and clear free-versus-paid access",
        "ADD: Secure shared backend/API, clinical tool registry, account entitlements, admin reports and early-access tracking",
        "REUSE: Two approved public tools; add save-result capability only after privacy/data-governance approval."
      ]
    },
    {
      "stage": 3,
      "name": "Cross-platform mobile application",
      "features": [
        "ADD: Flutter iOS and Android apps, onboarding, Home/Tools/Progress/Learn/Profile",
        "ADD: Blood-pressure, weight and waist manual logs and trend charts",
        "ADD: Protein/energy/fibre targets and manual food/macronutrient tracker, saved meals",
        "ADD: Goal/programme synchronisation, personalised reviewed content, bookmarks and subscriptions/restore purchase",
        "ADD: Optional simple activity and sleep diary, reminders and shareable personal progress summary",
        "ADD: Offline public-article reading, feedback, secure mobile identity and server feature flags",
        "REUSE: Stage 2 shared backend, approved tool engines and WordPress knowledge content."
      ]
    },
    {
      "stage": 4,
      "name": "Unified advanced health platform",
      "features": [
        "ADD: Logged-in personalised website dashboard sharing mobile user identity, goals and progress",
        "ADD: Enhanced explainable recommendation rules, editorial approvals and member data portability",
        "ADD: Packaged food barcode lookup with source/provenance checks",
        "OPTIONAL: Recipe nutrition builder and user-correctable AI food-photo suggestions",
        "OPTIONAL: Consented Apple Health / Android health-platform imports where feasible",
        "ADD: Cross-platform privacy-preserving conversion analytics and performance reporting",
        "REASSESS: Newspaper theme performance/compatibility (replace only if justified); localisation and community remain optional."
      ]
    }
  ],
  "actors": [
    {
      "id": "ACT-01",
      "name": "Public visitor"
    },
    {
      "id": "ACT-02",
      "name": "WordPress editor/publisher"
    },
    {
      "id": "ACT-03",
      "name": "Clinical reviewer"
    },
    {
      "id": "ACT-04",
      "name": "Site administrator / release owner"
    },
    {
      "id": "ACT-05",
      "name": "AI implementer agent"
    },
    {
      "id": "ACT-06",
      "name": "AI reviewer agent"
    },
    {
      "id": "ACT-07",
      "name": "AI oracle author (sealed)"
    },
    {
      "id": "ACT-08",
      "name": "External services"
    }
  ],
  "components": [
    {
      "id": "CMP-01",
      "name": "WordPress core, Newspaper theme, posts, menus",
      "paths": [],
      "in_scope_for_component_scope": false
    },
    {
      "id": "CMP-02",
      "name": "public_html/tools/protein-requirement-tool.html",
      "paths": [
        "site/public_html/tools/protein-requirement-tool.html"
      ],
      "in_scope_for_component_scope": true
    },
    {
      "id": "CMP-03",
      "name": "public_html/tools/diabetes-risk-tool.html",
      "paths": [
        "site/public_html/tools/diabetes-risk-tool.html"
      ],
      "in_scope_for_component_scope": true
    },
    {
      "id": "CMP-04",
      "name": "public_html/tools/submit-protein.php + api/templates-protein.php",
      "paths": [
        "site/public_html/tools/submit-protein.php",
        "site/public_html/tools/api/templates-protein.php"
      ],
      "in_scope_for_component_scope": true
    },
    {
      "id": "CMP-05",
      "name": "public_html/tools/submit.php + api/templates.php",
      "paths": [
        "site/public_html/tools/submit.php",
        "site/public_html/tools/api/templates.php",
        "site/public_html/tools/api/render.php",
        "site/public_html/tools/api/validate.php"
      ],
      "in_scope_for_component_scope": true
    },
    {
      "id": "CMP-06",
      "name": "public_html/tools/api/mailer.php + api/config.php",
      "paths": [
        "site/public_html/tools/api/mailer.php",
        "site/public_html/tools/api/ratelimit.php",
        "site/public_html/tools/api/config.example.php",
        "site/public_html/tools/api/log.php"
      ],
      "in_scope_for_component_scope": true
    },
    {
      "id": "CMP-07",
      "name": "public_html/tools/status.json",
      "paths": [
        "site/public_html/tools/status.json"
      ],
      "in_scope_for_component_scope": true
    },
    {
      "id": "CMP-08",
      "name": "wp-content/mu-plugins/lld-tools/",
      "paths": [
        "site/public_html/wp-content/mu-plugins/**"
      ],
      "in_scope_for_component_scope": true
    },
    {
      "id": "CMP-09",
      "name": "WP pages: home, hub, 2 landing, medical disclaimer",
      "paths": [],
      "in_scope_for_component_scope": false
    },
    {
      "id": "CMP-10",
      "name": "Web server config (.htaccess/vhost)",
      "paths": [
        "site/public_html/.htaccess.lld",
        "site/public_html/tools/.htaccess",
        "site/public_html/tools/api/.htaccess"
      ],
      "in_scope_for_component_scope": true
    },
    {
      "id": "CMP-11",
      "name": "Analytics (Plausible) integration",
      "paths": [
        "site/public_html/wp-content/mu-plugins/lld-tools/analytics/**"
      ],
      "in_scope_for_component_scope": true
    },
    {
      "id": "CMP-12",
      "name": "Repository artefacts",
      "paths": [
        "manifests/**",
        "approvals/**",
        "fixtures/**",
        "evidence/**",
        "content/**",
        "copy/**",
        "privacy/**",
        "releases/**",
        "incidents/**",
        "reports/**"
      ],
      "in_scope_for_component_scope": true
    },
    {
      "id": "CMP-13",
      "name": "CI pipeline",
      "paths": [
        ".github/**",
        "deploy/**",
        "tools/**",
        "tests/**",
        "package.json"
      ],
      "in_scope_for_component_scope": true
    },
    {
      "id": "CMP-14",
      "name": "Oracles ORC-01..04",
      "paths": [
        "oracles/**"
      ],
      "in_scope_for_component_scope": true
    }
  ],
  "use_cases": [
    {
      "id": "UC1-01",
      "title": "Visitor uses the protein tool from a campaign link",
      "e2e": "E2E-01"
    },
    {
      "id": "UC1-02",
      "title": "Visitor uses the diabetes risk check",
      "e2e": "E2E-02"
    },
    {
      "id": "UC1-03",
      "title": "Editor links an article to a tool",
      "e2e": "E2E-03"
    },
    {
      "id": "UC1-04",
      "title": "Clinical reviewer withdraws a tool",
      "e2e": "E2E-04"
    },
    {
      "id": "UC1-05",
      "title": "Publisher measures a campaign",
      "e2e": "E2E-05"
    },
    {
      "id": "UC1-06",
      "title": "Keyboard and screen-reader visitor completes both tools",
      "e2e": "E2E-06"
    },
    {
      "id": "UC1-07",
      "title": "Release owner ships Stage 1",
      "e2e": "E2E-07"
    }
  ],
  "requirements": [
    {
      "id": "FR1-01",
      "category": "functional",
      "title": "Existing implementation audit and characterisation baseline",
      "priority": "MUST",
      "type": "process",
      "automation": "hybrid",
      "status": "accepted",
      "depends_on": [],
      "components": [
        "CMP-01",
        "CMP-02",
        "CMP-03",
        "CMP-04",
        "CMP-05",
        "CMP-06"
      ],
      "must_not_touch": [
        "*"
      ],
      "use_cases": [
        "UC1-01",
        "UC1-02",
        "UC1-03",
        "UC1-04",
        "UC1-05",
        "UC1-06",
        "UC1-07"
      ],
      "test_case": "TC-FR1-01",
      "assertions": [
        "TC-FR1-01-AS-01",
        "TC-FR1-01-AS-02",
        "TC-FR1-01-AS-03",
        "TC-FR1-01-AS-04",
        "TC-FR1-01-AS-05",
        "TC-FR1-01-AS-06"
      ],
      "fixtures": [
        "FX-PR-*",
        "FX-DM-*",
        "FX-WP-URLS"
      ],
      "decisions": [
        "DEC-01",
        "DEC-26"
      ],
      "human_gate": "HG-01",
      "mutations": [],
      "known_deviations": {},
      "evidence_dir": "evidence/FR1-01/",
      "spec": "01_SRS_Stage1_v1_2.md",
      "tests": "03_Test_Criteria_Stage1_v1_2.md"
    },
    {
      "id": "FR1-02",
      "category": "functional",
      "title": "Preserve WordPress and Newspaper",
      "priority": "MUST",
      "type": "behaviour",
      "automation": "auto",
      "status": "draft",
      "depends_on": [
        "FR1-01"
      ],
      "components": [
        "CMP-01"
      ],
      "must_not_touch": [